{
  "schema_version": "1.0",
  "bundle_version": "bocom-hk-public-2026-10-03-r1",
  "title": "交通银行（香港）公开金融知识候选库",
  "retrieved_on": "2026-10-03",
  "primary_entity": "交通银行（香港）有限公司",
  "jurisdiction": "HK",
  "publication_status": "staged_not_integrated",
  "review_policy": "review_due_on 是本项目内部复核期限，不是银行产品有效期；过期候选需重新查源，不自动继续使用。null 表示来源未明确，不可补填银行有效期。",
  "sources": [
    {
      "id": "S01",
      "title": "遥距开户概览",
      "url": "https://hk.bankcomm.com/hk/shtml/hk/en/2005575/2602047/list.shtml?channelId=2005575",
      "entity": "bank_hk_ltd",
      "jurisdiction": "HK",
      "publisher": "交通银行（香港）有限公司",
      "verification": "read_page",
      "locator": "准备事项及流程",
      "published_on": null,
      "retrieved_on": "2026-10-03",
      "document_effective_from": null,
      "document_valid_until": null,
      "note": "页面未明示发布日期的字段保留 null；核对日期不表示银行批准。"
    },
    {
      "id": "S02",
      "title": "遥距开户 FAQ",
      "url": "https://hk.bankcomm.com/hk/shtml/hk/en/2005575/2602047/2626806.shtml?channelId=2005575",
      "entity": "bank_hk_ltd",
      "jurisdiction": "HK",
      "publisher": "交通银行（香港）有限公司",
      "verification": "read_browser",
      "locator": "FAQ 第 2–7、17 项",
      "published_on": null,
      "retrieved_on": "2026-10-03",
      "document_effective_from": null,
      "document_valid_until": null,
      "note": "页面未明示发布日期的字段保留 null；核对日期不表示银行批准。"
    },
    {
      "id": "S03",
      "title": "个人定期及通知存款",
      "url": "https://hk.bankcomm.com/hk/shtml/hk/cn/2005276/2005277/2005284/2005286/list.shtml?channelId=2005276",
      "entity": "bank_hk_ltd",
      "jurisdiction": "HK",
      "publisher": "交通银行（香港）有限公司",
      "verification": "read_page",
      "locator": "定期／人民币／通知存款分节",
      "published_on": null,
      "retrieved_on": "2026-10-03",
      "document_effective_from": null,
      "document_valid_until": null,
      "note": "页面未明示发布日期的字段保留 null；核对日期不表示银行批准。"
    },
    {
      "id": "S04",
      "title": "DreamCash 所需文件",
      "url": "https://www.hk.bankcomm.com/hk/shtml/hk/tw/2004980/2005048/2005049/2073765.shtml?channelId=2004980",
      "entity": "bank_hk_ltd",
      "jurisdiction": "HK",
      "publisher": "交通银行（香港）有限公司",
      "verification": "read_page",
      "locator": "身份证明、住址、收入及自雇人士分节",
      "published_on": null,
      "retrieved_on": "2026-10-03",
      "document_effective_from": null,
      "document_valid_until": null,
      "note": "页面未明示发布日期的字段保留 null；核对日期不表示银行批准。"
    },
    {
      "id": "S05",
      "title": "DreamCash 本金利息及提前清还 FAQ",
      "url": "https://eb.hk.bankcomm.com/eb/html/zh_CN/loan_shouxufei.html",
      "entity": "bank_hk_ltd",
      "jurisdiction": "HK",
      "publisher": "交通银行（香港）有限公司",
      "verification": "read_page",
      "locator": "第 2–5 项：提前清还、冷静期、不接受部分清还",
      "published_on": null,
      "retrieved_on": "2026-10-03",
      "document_effective_from": null,
      "document_valid_until": null,
      "note": "页面未明示发布日期的字段保留 null；核对日期不表示银行批准。"
    },
    {
      "id": "S06",
      "title": "企业开户文件分类入口",
      "url": "https://www.hk.bankcomm.com/hk/shtml/hk/tw/2005089/2005091/2007090/list.shtml",
      "entity": "bank_hk_ltd",
      "jurisdiction": "HK",
      "publisher": "交通银行（香港）有限公司",
      "verification": "read_page",
      "locator": "按企业法律形态划分的文件链接",
      "published_on": null,
      "retrieved_on": "2026-10-03",
      "document_effective_from": null,
      "document_valid_until": null,
      "note": "页面未明示发布日期的字段保留 null；核对日期不表示银行批准。"
    },
    {
      "id": "S07",
      "title": "简易银行账户",
      "url": "https://www.bankcomm.com.hk/hk/shtml/hk/tw/2005089/5005256/list.shtml?channelId=2005089",
      "entity": "bank_hk_ltd",
      "jurisdiction": "HK",
      "publisher": "交通银行（香港）有限公司",
      "verification": "read_page",
      "locator": "适用公司、账户种类及本地转账限制；以页脚实体为准",
      "published_on": null,
      "retrieved_on": "2026-10-03",
      "document_effective_from": null,
      "document_valid_until": null,
      "note": "页面未明示发布日期的字段保留 null；核对日期不表示银行批准。"
    },
    {
      "id": "S08",
      "title": "企业网上银行",
      "url": "https://www.hk.bankcomm.com/hk/shtml/hk/tw/2005089/2005090/list.shtml?channelId=2005089",
      "entity": "bank_hk_ltd",
      "jurisdiction": "HK",
      "publisher": "交通银行（香港）有限公司",
      "verification": "read_page",
      "locator": "用户角色及账务查询／电子结单",
      "published_on": null,
      "retrieved_on": "2026-10-03",
      "document_effective_from": null,
      "document_valid_until": null,
      "note": "页面未明示发布日期的字段保留 null；核对日期不表示银行批准。"
    },
    {
      "id": "S09",
      "title": "企业流动电话银行",
      "url": "https://www.bankcomm.com.hk/hk/shtml/hk/tw/2005089/2602794/list.shtml",
      "entity": "bank_hk_ltd",
      "jurisdiction": "HK",
      "publisher": "交通银行（香港）有限公司",
      "verification": "read_page",
      "locator": "账务查询、指令授权、预约交易；以页脚实体为准",
      "published_on": null,
      "retrieved_on": "2026-10-03",
      "document_effective_from": null,
      "document_valid_until": null,
      "note": "页面未明示发布日期的字段保留 null；核对日期不表示银行批准。"
    },
    {
      "id": "S10",
      "title": "企业融资",
      "url": "https://www.hk.bankcomm.com/hk/shtml/hk/tw/2005089/2005097/2005098/list.shtml?channelId=2005089",
      "entity": "bank_hk_ltd",
      "jurisdiction": "HK",
      "publisher": "交通银行（香港）有限公司",
      "verification": "read_page",
      "locator": "项目及过渡融资概览",
      "published_on": null,
      "retrieved_on": "2026-10-03",
      "document_effective_from": null,
      "document_valid_until": null,
      "note": "页面未明示发布日期的字段保留 null；核对日期不表示银行批准。"
    },
    {
      "id": "S11",
      "title": "进口服务",
      "url": "https://www.hk.bankcomm.com/hk/shtml/hk/tw/2005089/2005104/2005105/list.shtml?channelId=2005089",
      "entity": "bank_hk_ltd",
      "jurisdiction": "HK",
      "publisher": "交通银行（香港）有限公司",
      "verification": "read_page",
      "locator": "进口贸易融资产品名称",
      "published_on": null,
      "retrieved_on": "2026-10-03",
      "document_effective_from": null,
      "document_valid_until": null,
      "note": "页面未明示发布日期的字段保留 null；核对日期不表示银行批准。"
    },
    {
      "id": "S12",
      "title": "交银香港：中小企融资担保计划",
      "url": "https://www.hk.bankcomm.com/hk/shtml/hk/tw/2005089/2005109/2005111/list.shtml?channelId=2005089",
      "entity": "bank_hk_ltd",
      "jurisdiction": "HK",
      "publisher": "交通银行（香港）有限公司",
      "verification": "read_page",
      "locator": "只采用银行参与及用途；不采用概览数字",
      "published_on": null,
      "retrieved_on": "2026-10-03",
      "document_effective_from": null,
      "document_valid_until": null,
      "note": "页面未注明有效期，仅采用已读概念与参与信息；额度、担保比例、期限均留待最新产品文件核对。"
    },
    {
      "id": "S13",
      "title": "外汇远期合约",
      "url": "https://www.hk.bankcomm.com/hk/shtml/hk/tw/2005089/2005115/2005116/list.shtml?channelId=2005116",
      "entity": "bank_hk_ltd",
      "jurisdiction": "HK",
      "publisher": "交通银行（香港）有限公司",
      "verification": "read_page",
      "locator": "远期合约概念及风险",
      "published_on": null,
      "retrieved_on": "2026-10-03",
      "document_effective_from": null,
      "document_valid_until": null,
      "note": "页面未明示发布日期的字段保留 null；核对日期不表示银行批准。"
    },
    {
      "id": "S14",
      "title": "投委会：月平息睇真啲",
      "url": "https://www.ifec.org.hk/web/tc/moneyessentials/debts-and-borrowing/take-new-loan/Monthly-flat-rate.page",
      "entity": "hk_financial_education",
      "jurisdiction": "HK",
      "publisher": "投资者及理财教育委员会",
      "verification": "read_page",
      "locator": "月平息与实际年利率",
      "published_on": "2021-06-08",
      "retrieved_on": "2026-10-03",
      "document_effective_from": null,
      "document_valid_until": null,
      "note": "页面未明示发布日期的字段保留 null；核对日期不表示银行批准。"
    },
    {
      "id": "S15",
      "title": "投委会：提前还款与78法则",
      "url": "https://www.ifec.org.hk/web/tc/moneyessentials/debts-and-borrowing/manage-exist-debt/Early-repayment.page",
      "entity": "hk_financial_education",
      "jurisdiction": "HK",
      "publisher": "投资者及理财教育委员会",
      "verification": "read_page",
      "locator": "利息分配及提前清还成本",
      "published_on": "2019-12-12",
      "retrieved_on": "2026-10-03",
      "document_effective_from": null,
      "document_valid_until": null,
      "note": "页面未明示发布日期的字段保留 null；核对日期不表示银行批准。"
    },
    {
      "id": "S16",
      "title": "存保委员会：存保计划特点",
      "url": "https://www.dps.org.hk/tc/for-depositors/features-of-dps/",
      "entity": "hk_public_rules",
      "jurisdiction": "HK",
      "publisher": "香港存款保障委员会",
      "verification": "read_browser",
      "locator": "受保障及不受保障的产品",
      "published_on": null,
      "retrieved_on": "2026-10-03",
      "document_effective_from": null,
      "document_valid_until": null,
      "note": "页面未明示发布日期的字段保留 null；核对日期不表示银行批准。"
    },
    {
      "id": "S17",
      "title": "存保委员会：常见问题",
      "url": "https://www.dps.org.hk/tc/for-depositors/faqs/",
      "entity": "hk_public_rules",
      "jurisdiction": "HK",
      "publisher": "香港存款保障委员会",
      "verification": "read_browser",
      "locator": "保障水平；在浏览器展开官方FAQ后核实每位存款人每间成员银行的上限",
      "published_on": null,
      "retrieved_on": "2026-10-03",
      "document_effective_from": null,
      "document_valid_until": null,
      "note": "浏览器已核实保障水平分节；其他FAQ分节没有据此自动视作已读。"
    },
    {
      "id": "S18",
      "title": "香港政府新闻：存款保障上限调整",
      "url": "https://www.news.gov.hk/chi/2024/07/20240703/20240703_193656_291.html?name=finance&type=category",
      "entity": "hk_public_rules",
      "jurisdiction": "HK",
      "publisher": "香港特区政府新闻处",
      "verification": "read_page",
      "locator": "2024-10-01 保障上限调整",
      "published_on": "2024-07-03",
      "retrieved_on": "2026-10-03",
      "document_effective_from": null,
      "document_valid_until": null,
      "note": "2026-10-03接入前补齐核查：采用已完整读取的政府新闻正文，替代原历史页面的搜索摘录。"
    },
    {
      "id": "S19",
      "title": "香港政府：中小企融资担保新措施",
      "url": "https://www.info.gov.hk/gia/general/202509/17/P2025091700598.htm",
      "entity": "hk_public_rules",
      "jurisdiction": "HK",
      "publisher": "香港特区政府新闻公报（代香港金融管理局发出）",